{
  "contractVersion": 1,
  "matchId": "match_fixture",
  "snapshotRevision": 8,
  "actionId": "discard_0_2",
  "type": "DISCARD",
  "actor": 0,
  "sourceId": null,
  "targetId": null,
  "cardId": null,
  "selectedEntityIds": [102, 103],
  "payload": {
    "requiredCount": 2,
    "candidateIds": [101, 102, 103]
  }
}
